{
    "Manufacturer": "Ferroxcube",
    "MagCore": "U",
    "Reference": "U25/16/6",
    "A": 25.4,
    "B": 12.7,
    "Bp": 0.0,
    "C": 0.0,
    "Cp": 0.0,
    "D": 15.9,
    "E": 9.5,
    "F": 6.4,
    "G": 0.0,
    "I": 0.0,
    "Gap": 0.0,
    "CoreType": [
        "XY",
        "2LEG",
        "SET"
    ]
}